[
  {
    "strName": "Plot Manager Settings",
    "fTensionPeriod": 540,
    "fReleasePeriod": 650,
    "fSocialPeriod": 300,
    "fAutosavePeriod": 903,
    "dictEventChances": {
      "release_bonus_derelict": 0.1,
      "release_meat_derelict": 0.2,
      "release_plot": 0.65,
      "release_reactor_part": 0.05,
      "tension_meat_derelict": 0.1,
      "tension_plot": 0.5,
      "tension_mariner": 0.05,
      "tension_micrometeoroid": 0.025,
      "tension_police_patrol": 0.05,
      "tension_part_failure": 0.125,
      "tension_emotional_clobber": 0.05,
      "tension_message_from_derelict": 0.025,
      "tension_pirate_spawn": 0.075
    }
  }
]